{"$schema":"https://json-schema.org/draft/2020-12/schema","additionalProperties":false,"properties":{"attributionMode":{"enum":["byline","newsroom","assisted"],"type":"string"},"blocks":{"items":{"oneOf":[{"properties":{"id":{"maxLength":200,"minLength":1,"pattern":"^[A-Za-z0-9][A-Za-z0-9._:-]*$","type":"string"},"provenance":{"items":{"properties":{"confidence":{"maximum":1,"minimum":0,"type":"number"},"origin":{"enum":["external_source","cinerie_catalog","cinerie_editorial","licensed_media","human_input","inference"],"type":"string"},"ref":{"maxLength":200,"minLength":1,"pattern":"^[A-Za-z0-9][A-Za-z0-9._:-]*$","type":"string"}},"required":["origin"],"type":"object"},"maxItems":10,"type":"array"},"text":{"maxLength":5000,"minLength":1,"type":"string"},"type":{"const":"paragraph","type":"string"}},"required":["id","type","text"],"type":"object"},{"properties":{"id":{"maxLength":200,"minLength":1,"pattern":"^[A-Za-z0-9][A-Za-z0-9._:-]*$","type":"string"},"level":{"anyOf":[{"const":2,"type":"number"},{"const":3,"type":"number"},{"const":4,"type":"number"}]},"provenance":{"items":{"properties":{"confidence":{"maximum":1,"minimum":0,"type":"number"},"origin":{"enum":["external_source","cinerie_catalog","cinerie_editorial","licensed_media","human_input","inference"],"type":"string"},"ref":{"maxLength":200,"minLength":1,"pattern":"^[A-Za-z0-9][A-Za-z0-9._:-]*$","type":"string"}},"required":["origin"],"type":"object"},"maxItems":10,"type":"array"},"text":{"maxLength":500,"minLength":1,"type":"string"},"type":{"const":"heading","type":"string"}},"required":["id","type","level","text"],"type":"object"},{"properties":{"alt":{"maxLength":500,"minLength":1,"type":"string"},"caption":{"maxLength":500,"minLength":1,"type":"string"},"credit":{"maxLength":500,"minLength":1,"type":"string"},"id":{"maxLength":200,"minLength":1,"pattern":"^[A-Za-z0-9][A-Za-z0-9._:-]*$","type":"string"},"mediaRef":{"maxLength":200,"minLength":1,"pattern":"^[A-Za-z0-9][A-Za-z0-9._:-]*$","type":"string"},"provenance":{"items":{"properties":{"confidence":{"maximum":1,"minimum":0,"type":"number"},"origin":{"enum":["external_source","cinerie_catalog","cinerie_editorial","licensed_media","human_input","inference"],"type":"string"},"ref":{"maxLength":200,"minLength":1,"pattern":"^[A-Za-z0-9][A-Za-z0-9._:-]*$","type":"string"}},"required":["origin"],"type":"object"},"maxItems":10,"type":"array"},"type":{"const":"image","type":"string"}},"required":["id","type","mediaRef","alt"],"type":"object"},{"properties":{"credit":{"maxLength":500,"minLength":1,"type":"string"},"externalId":{"maxLength":200,"minLength":1,"pattern":"^[A-Za-z0-9][A-Za-z0-9._:-]*$","type":"string"},"id":{"maxLength":200,"minLength":1,"pattern":"^[A-Za-z0-9][A-Za-z0-9._:-]*$","type":"string"},"provenance":{"items":{"properties":{"confidence":{"maximum":1,"minimum":0,"type":"number"},"origin":{"enum":["external_source","cinerie_catalog","cinerie_editorial","licensed_media","human_input","inference"],"type":"string"},"ref":{"maxLength":200,"minLength":1,"pattern":"^[A-Za-z0-9][A-Za-z0-9._:-]*$","type":"string"}},"required":["origin"],"type":"object"},"maxItems":10,"type":"array"},"provider":{"enum":["youtube","vimeo","internal"],"type":"string"},"title":{"maxLength":500,"minLength":1,"type":"string"},"type":{"const":"video","type":"string"},"url":{"maxLength":2048,"minLength":1,"type":"string"}},"required":["id","type","provider"],"type":"object"},{"properties":{"attribution":{"maxLength":500,"minLength":1,"type":"string"},"id":{"maxLength":200,"minLength":1,"pattern":"^[A-Za-z0-9][A-Za-z0-9._:-]*$","type":"string"},"provenance":{"items":{"properties":{"confidence":{"maximum":1,"minimum":0,"type":"number"},"origin":{"enum":["external_source","cinerie_catalog","cinerie_editorial","licensed_media","human_input","inference"],"type":"string"},"ref":{"maxLength":200,"minLength":1,"pattern":"^[A-Za-z0-9][A-Za-z0-9._:-]*$","type":"string"}},"required":["origin"],"type":"object"},"maxItems":10,"type":"array"},"sourceRef":{"maxLength":200,"minLength":1,"pattern":"^[A-Za-z0-9][A-Za-z0-9._:-]*$","type":"string"},"text":{"maxLength":5000,"minLength":1,"type":"string"},"type":{"const":"quote","type":"string"}},"required":["id","type","text"],"type":"object"},{"properties":{"entityId":{"maxLength":200,"minLength":1,"pattern":"^[A-Za-z0-9][A-Za-z0-9._:-]*$","type":"string"},"entityKind":{"enum":["movie","tv","season","episode","person","character","franchise"],"type":"string"},"id":{"maxLength":200,"minLength":1,"pattern":"^[A-Za-z0-9][A-Za-z0-9._:-]*$","type":"string"},"note":{"maxLength":500,"minLength":1,"type":"string"},"provenance":{"items":{"properties":{"confidence":{"maximum":1,"minimum":0,"type":"number"},"origin":{"enum":["external_source","cinerie_catalog","cinerie_editorial","licensed_media","human_input","inference"],"type":"string"},"ref":{"maxLength":200,"minLength":1,"pattern":"^[A-Za-z0-9][A-Za-z0-9._:-]*$","type":"string"}},"required":["origin"],"type":"object"},"maxItems":10,"type":"array"},"type":{"const":"entityCard","type":"string"}},"required":["id","type","entityKind","entityId"],"type":"object"},{"properties":{"id":{"maxLength":200,"minLength":1,"pattern":"^[A-Za-z0-9][A-Za-z0-9._:-]*$","type":"string"},"items":{"items":{"properties":{"label":{"maxLength":500,"minLength":1,"type":"string"},"value":{"maxLength":500,"minLength":1,"type":"string"}},"required":["label","value"],"type":"object"},"maxItems":30,"minItems":1,"type":"array"},"provenance":{"items":{"properties":{"confidence":{"maximum":1,"minimum":0,"type":"number"},"origin":{"enum":["external_source","cinerie_catalog","cinerie_editorial","licensed_media","human_input","inference"],"type":"string"},"ref":{"maxLength":200,"minLength":1,"pattern":"^[A-Za-z0-9][A-Za-z0-9._:-]*$","type":"string"}},"required":["origin"],"type":"object"},"maxItems":10,"type":"array"},"title":{"maxLength":500,"minLength":1,"type":"string"},"type":{"const":"factBox","type":"string"}},"required":["id","type","title","items"],"type":"object"},{"properties":{"articleRefs":{"items":{"maxLength":200,"minLength":1,"pattern":"^[A-Za-z0-9][A-Za-z0-9._:-]*$","type":"string"},"maxItems":20,"minItems":1,"type":"array"},"id":{"maxLength":200,"minLength":1,"pattern":"^[A-Za-z0-9][A-Za-z0-9._:-]*$","type":"string"},"provenance":{"items":{"properties":{"confidence":{"maximum":1,"minimum":0,"type":"number"},"origin":{"enum":["external_source","cinerie_catalog","cinerie_editorial","licensed_media","human_input","inference"],"type":"string"},"ref":{"maxLength":200,"minLength":1,"pattern":"^[A-Za-z0-9][A-Za-z0-9._:-]*$","type":"string"}},"required":["origin"],"type":"object"},"maxItems":10,"type":"array"},"type":{"const":"relatedContent","type":"string"}},"required":["id","type","articleRefs"],"type":"object"},{"properties":{"id":{"maxLength":200,"minLength":1,"pattern":"^[A-Za-z0-9][A-Za-z0-9._:-]*$","type":"string"},"provenance":{"items":{"properties":{"confidence":{"maximum":1,"minimum":0,"type":"number"},"origin":{"enum":["external_source","cinerie_catalog","cinerie_editorial","licensed_media","human_input","inference"],"type":"string"},"ref":{"maxLength":200,"minLength":1,"pattern":"^[A-Za-z0-9][A-Za-z0-9._:-]*$","type":"string"}},"required":["origin"],"type":"object"},"maxItems":10,"type":"array"},"sourceRefs":{"items":{"maxLength":200,"minLength":1,"pattern":"^[A-Za-z0-9][A-Za-z0-9._:-]*$","type":"string"},"maxItems":50,"minItems":1,"type":"array"},"type":{"const":"sourceList","type":"string"}},"required":["id","type","sourceRefs"],"type":"object"},{"properties":{"id":{"maxLength":200,"minLength":1,"pattern":"^[A-Za-z0-9][A-Za-z0-9._:-]*$","type":"string"},"provenance":{"items":{"properties":{"confidence":{"maximum":1,"minimum":0,"type":"number"},"origin":{"enum":["external_source","cinerie_catalog","cinerie_editorial","licensed_media","human_input","inference"],"type":"string"},"ref":{"maxLength":200,"minLength":1,"pattern":"^[A-Za-z0-9][A-Za-z0-9._:-]*$","type":"string"}},"required":["origin"],"type":"object"},"maxItems":10,"type":"array"},"type":{"const":"divider","type":"string"}},"required":["id","type"],"type":"object"}]},"maxItems":200,"minItems":1,"type":"array"},"contentType":{"enum":["news","feature","review","guide","list","interview","evergreen"],"type":"string"},"contractName":{"const":"editorial-publication-request-v1","type":"string"},"contractVersion":{"const":"1.0.0","type":"string"},"entityLinks":{"default":[],"items":{"properties":{"confidence":{"maximum":1,"minimum":0,"type":"number"},"entityId":{"maxLength":200,"minLength":1,"pattern":"^[A-Za-z0-9][A-Za-z0-9._:-]*$","type":"string"},"entityKind":{"enum":["movie","tv","season","episode","person","character","franchise"],"type":"string"},"relation":{"enum":["primary_subject","secondary_subject","mentioned","reviewed","recommended","compared"],"type":"string"}},"required":["entityKind","entityId","relation","confidence"],"type":"object"},"maxItems":100,"type":"array"},"externalSources":{"default":[],"items":{"properties":{"id":{"maxLength":200,"minLength":1,"pattern":"^[A-Za-z0-9][A-Za-z0-9._:-]*$","type":"string"},"name":{"maxLength":500,"minLength":1,"type":"string"},"publishedAt":{"maxLength":64,"minLength":1,"type":"string"},"role":{"enum":["primary","secondary","press_release","catalog"],"type":"string"},"url":{"maxLength":2048,"minLength":1,"type":"string"}},"required":["id","name","url","role"],"type":"object"},"maxItems":50,"type":"array"},"generatedAt":{"maxLength":64,"minLength":1,"type":"string"},"idempotencyKey":{"maxLength":200,"minLength":1,"pattern":"^[A-Za-z0-9][A-Za-z0-9._:-]*$","type":"string"},"language":{"maxLength":16,"minLength":2,"pattern":"^[a-z]{2,3}(?:-[A-Za-z0-9]{2,8})*$","type":"string"},"media":{"default":[],"items":{"properties":{"altSuggestion":{"maxLength":500,"minLength":1,"type":"string"},"intendedUse":{"enum":["hero","inline","gallery","social"],"type":"string"},"mediaId":{"maxLength":200,"minLength":1,"pattern":"^[A-Za-z0-9][A-Za-z0-9._:-]*$","type":"string"}},"required":["mediaId","intendedUse"],"type":"object"},"maxItems":50,"type":"array"},"pipelineVersion":{"maxLength":500,"minLength":1,"type":"string"},"provenance":{"properties":{"inputHash":{"maxLength":128,"minLength":16,"pattern":"^[a-f0-9]+$","type":"string"},"model":{"maxLength":500,"minLength":1,"type":"string"},"pipeline":{"maxLength":500,"minLength":1,"type":"string"},"promptVersion":{"maxLength":500,"minLength":1,"type":"string"}},"required":["pipeline","inputHash"],"type":"object"},"publicAuthorId":{"maxLength":200,"minLength":1,"pattern":"^[A-Za-z0-9][A-Za-z0-9._:-]*$","type":"string"},"publicationIntent":{"enum":["publish","update"],"type":"string"},"qa":{"properties":{"blockingErrors":{"default":[],"items":{"maxLength":500,"minLength":1,"type":"string"},"maxItems":100,"type":"array"},"passed":{"type":"boolean"},"version":{"maxLength":500,"minLength":1,"type":"string"},"warnings":{"default":[],"items":{"maxLength":500,"minLength":1,"type":"string"},"maxItems":100,"type":"array"}},"required":["version","passed"],"type":"object"},"requestId":{"maxLength":200,"minLength":1,"pattern":"^[A-Za-z0-9][A-Za-z0-9._:-]*$","type":"string"},"schemaHash":{"pattern":"^sha256:[0-9a-f]{64}$","type":"string"},"seo":{"additionalProperties":false,"properties":{"articleSectionSuggestion":{"maxLength":500,"minLength":1,"type":"string"},"editorialKeywords":{"default":[],"items":{"maxLength":60,"minLength":1,"type":"string"},"maxItems":20,"type":"array"},"focusKeyphrase":{"maxLength":80,"minLength":1,"type":"string"},"imageAltSuggestions":{"default":[],"items":{"properties":{"alt":{"maxLength":200,"minLength":1,"type":"string"},"mediaRef":{"maxLength":200,"minLength":1,"pattern":"^[A-Za-z0-9][A-Za-z0-9._:-]*$","type":"string"}},"required":["mediaRef","alt"],"type":"object"},"maxItems":20,"type":"array"},"internalLinkSuggestions":{"default":[],"items":{"properties":{"anchorText":{"maxLength":500,"minLength":1,"type":"string"},"confidence":{"maximum":1,"minimum":0,"type":"number"},"reason":{"maxLength":500,"minLength":1,"type":"string"},"sourceContext":{"maxLength":500,"minLength":1,"type":"string"},"targetId":{"maxLength":200,"minLength":1,"pattern":"^[A-Za-z0-9][A-Za-z0-9._:-]*$","type":"string"},"targetPath":{"maxLength":2048,"minLength":1,"pattern":"^\\/[^\\s]*$","type":"string"},"targetType":{"enum":["article","movie","tv_show","person","collection","section"],"type":"string"}},"required":["targetType","anchorText"],"type":"object"},"maxItems":20,"type":"array"},"metaDescription":{"maxLength":320,"minLength":1,"type":"string"},"openGraphDescriptionSuggestion":{"maxLength":220,"minLength":1,"type":"string"},"openGraphTitleSuggestion":{"maxLength":120,"minLength":1,"type":"string"},"relatedKeyphrases":{"default":[],"items":{"maxLength":80,"minLength":1,"type":"string"},"maxItems":10,"type":"array"},"schemaTypeRecommendation":{"enum":["NewsArticle","Article","Review","ItemList","HowTo"],"type":"string"},"slugSuggestion":{"maxLength":200,"minLength":1,"pattern":"^[a-z0-9]+(?:-[a-z0-9]+)*$","type":"string"},"title":{"maxLength":120,"minLength":1,"type":"string"},"twitterDescriptionSuggestion":{"maxLength":220,"minLength":1,"type":"string"},"twitterTitleSuggestion":{"maxLength":120,"minLength":1,"type":"string"},"version":{"const":"seo-proposal-v1","type":"string"}},"required":["version","title","metaDescription","slugSuggestion","focusKeyphrase","schemaTypeRecommendation"],"type":"object"},"sourceClusterId":{"maxLength":200,"minLength":1,"pattern":"^[A-Za-z0-9][A-Za-z0-9._:-]*$","type":"string"},"sourcePayloadHash":{"maxLength":128,"minLength":16,"pattern":"^[a-f0-9]+$","type":"string"},"sourceRevision":{"maximum":9007199254740991,"minimum":0,"type":"integer"},"subtitle":{"maxLength":400,"minLength":1,"type":"string"},"summary":{"maxLength":2000,"minLength":1,"type":"string"},"targetArticleId":{"maxLength":200,"minLength":1,"pattern":"^[A-Za-z0-9][A-Za-z0-9._:-]*$","type":"string"},"title":{"maxLength":300,"minLength":1,"type":"string"}},"required":["contractName","contractVersion","schemaHash","requestId","idempotencyKey","sourceClusterId","sourceRevision","sourcePayloadHash","publicationIntent","publicAuthorId","attributionMode","contentType","language","title","summary","blocks","seo","provenance","qa","generatedAt","pipelineVersion"],"type":"object"}