{"contractName":"editorial-publication-request-v1","contractVersion":"1.0.0","schemaHash":"sha256:930243294465802778f73151d53ee510a2313d44673de9e6e7866032bfe6c6f8","requestId":"req-teste-001","idempotencyKey":"mnscr:teste:rev-1","sourceClusterId":"cluster-teste","sourceRevision":1,"sourcePayloadHash":"abcdef0123456789abcdef0123456789abcdef0123456789abcdef0123456789","publicationIntent":"publish","publicAuthorId":"1","attributionMode":"newsroom","contentType":"news","language":"pt-BR","title":"Estudio confirma data de estreia da nova serie","summary":"O estudio confirmou nesta terca-feira a data de estreia da nova serie, encerrando meses de especulacao entre os fas.","blocks":[{"id":"b1","type":"paragraph","text":"O estudio confirmou a data de estreia em comunicado enviado a imprensa nesta terca-feira."},{"id":"b2","type":"paragraph","text":"A primeira temporada tera oito episodios, com lancamento semanal apos a estreia dupla."}],"externalSources":[{"id":"src-variety","name":"Variety","url":"https://variety.com/exemplo-de-materia","role":"primary"}],"seo":{"version":"seo-proposal-v1","title":"Nova serie ganha data de estreia oficial","metaDescription":"O estudio confirmou a data de estreia da nova serie, que chega ao catalogo em marco com oito episodios e lancamento semanal.","slugSuggestion":"nova-serie-data-de-estreia-teste","focusKeyphrase":"data de estreia","schemaTypeRecommendation":"NewsArticle","articleSectionSuggestion":"Series"},"provenance":{"pipeline":"teste-manual","inputHash":"abcdef0123456789abcdef0123456789abcdef0123456789abcdef0123456789"},"qa":{"version":"qa@1","passed":true,"warnings":[],"blockingErrors":[]},"generatedAt":"2026-08-05T12:00:00.000Z","pipelineVersion":"teste-manual"}
